Title,Score,Total comments,URL
"‘Alternative’ National Park Service twitter gains 600,000 followers after Trump orders social media blackout - 'You can take our official twitter, but you'll never take our free time!’",4556,213,http://www.independent.co.uk/news/world/americas/alternative-national-park-service-twitter-account-followers-donald-trump-president-social-media-a7546531.html
"Donald Trump to completely turn off EPA's data service, one of govt's most important websites - The service is the govt's biggest citizen-linked data tool, & covers not just climate change but people's health & environment",2062,67,http://www.independent.co.uk/life-style/gadgets-and-tech/news/donald-trump-epa-website-turn-off-environmental-protection-agency-government-administration-a7698736.html
"Children Believe Humans and Farm Animals Should Be Treated Equally, Study Finds",1810,308,https://www.ecowatch.com/speciesism-develops-in-adolescence.html
"Notorious Rhino Poacher & Gang Member, Admiro Chauque, Sentenced To A Record 30 Years In Prison In Mozambique",1661,57,https://worldanimalnews.com/breaking-notorious-rhino-poacher-gang-member-admiro-chauqu-sentenced-to-a-record-30-years-in-prison-in-mozambique/
Local wolf pack wiped out by hunter - Instagram “influencer” responsible for the slaughter of entire wolf packs,1286,241,https://www.focusonvictoria.ca/reporting/34/?fbclid=IwAR0fEesXPX5knqdsVvOvTKK4KNhnVJx5IUDe4hOOuip7LSa31wtlMCOxiyQ
