Title,Score,Total comments,URL
"We should love cat, because cats are our friends, too. share my cute-girl",228,1,https://www.reddit.com/r/Animal/comments/tbjmk4/we_should_love_cat_because_cats_are_our_friends/
Haired child gripped by small squiral,94,0,https://i.redd.it/xe62a1adxni41.jpg
Wolf puppers,87,2,https://i.redd.it/2ajpmtdxhgn41.jpg
he's learning to shake. ohh he's so cuteeee doing that thing,84,1,https://v.redd.it/kdhl9welyro51
Hammerhead salamander,84,7,https://i.redd.it/8aon4rp4wbh71.jpg
