Title,Score,Total comments,URL
A friend went for a walk the other night and saw this woman just standing on a roof,91234,2952,https://i.imgur.com/k65tLfB.jpg
The missing persons map has a frightening similarity to the cave systems map,86409,1462,https://i.redd.it/a22oqqzck2z31.png
Reaper counting inventory,78752,1683,https://i.redd.it/lw3cvp0df0c11.gif
My husband just sent me this... it was taken on his way to work this morning.,72876,1689,https://i.redd.it/awievqv2ik701.jpg
Artist with Dementia,68100,1119,https://i.redd.it/762ad92toy331.png
